word,part_of_speech,definition,difficulty,length
epiphany,noun,The appearance of Jesus Christ to the Magi on the twelfth day after Christmas.,extreme,8
epiphany,noun,"An illuminating realization or discovery, often resulting in a personal feeling of elation, awe, or wonder.",extreme,8
lachrymose,adjective,"Tearful, sorrowful, sad, pertaining to tears, weeping, causing tears or crying.",extreme,10
soporific,noun,"Something inducing sleep, especially a drug.",extreme,9
soporific,adjective,(pharmaceutical effect) Tending to induce sleep.,extreme,9
dysfunctional,adjective,Not performing its proper or intended function.,extreme,13
onomatopoeia,noun,The property of a word of sounding like what it represents.,extreme,12
petrichor,noun,"The distinctive scent, caused by geosmin, which accompanies the first rain after a long, warm, dry spell.",extreme,9
obsequious,adjective,Obedient; compliant with someone else's orders or wishes.,extreme,10
